{
  "$schema": "https://json-schema.org/draft/2020-12/schema",
  "$id": "https://ds.hypoth.dev/schemas/audit-checklist.schema.json",
  "title": "AuditChecklist",
  "description": "Template defining manual accessibility tests for a component category",
  "type": "object",
  "required": ["id", "name", "description", "wcagVersion", "conformanceLevel", "items", "version"],
  "properties": {
    "id": {
      "type": "string",
      "pattern": "^[a-z][a-z0-9-]*$",
      "description": "Unique identifier (e.g., 'form-controls')"
    },
    "name": {
      "type": "string",
      "minLength": 1,
      "description": "Human-readable name"
    },
    "description": {
      "type": "string",
      "minLength": 1,
      "description": "Purpose of this checklist"
    },
    "wcagVersion": {
      "type": "string",
      "enum": ["2.0", "2.1", "2.2"],
      "description": "WCAG version"
    },
    "conformanceLevel": {
      "type": "string",
      "enum": ["A", "AA", "AAA"],
      "description": "Target conformance level"
    },
    "version": {
      "type": "string",
      "pattern": "^\\d+\\.\\d+\\.\\d+$",
      "description": "Checklist template version (semver)"
    },
    "items": {
      "type": "array",
      "minItems": 1,
      "items": {
        "$ref": "#/$defs/ChecklistItem"
      },
      "description": "Array of test items"
    }
  },
  "$defs": {
    "ChecklistItem": {
      "type": "object",
      "required": ["id", "criterion", "description", "procedure", "expectedOutcome"],
      "properties": {
        "id": {
          "type": "string",
          "pattern": "^[a-z]{2,3}-\\d{3}$",
          "description": "Unique item ID (e.g., 'fc-001')"
        },
        "criterion": {
          "type": "string",
          "pattern": "^\\d+\\.\\d+\\.\\d+$",
          "description": "WCAG success criterion (e.g., '1.3.1')"
        },
        "description": {
          "type": "string",
          "minLength": 1,
          "description": "What to test"
        },
        "procedure": {
          "type": "string",
          "minLength": 1,
          "description": "How to test"
        },
        "expectedOutcome": {
          "type": "string",
          "minLength": 1,
          "description": "What passing looks like"
        },
        "tools": {
          "type": "array",
          "items": { "type": "string" },
          "description": "Recommended testing tools"
        },
        "screenReaders": {
          "type": "array",
          "items": { "type": "string" },
          "description": "Screen readers to test with"
        }
      }
    }
  }
}
