{
  "id": "navigation",
  "name": "Navigation",
  "description": "Manual accessibility checklist for navigation components (links, tabs, breadcrumbs, pagination)",
  "wcagVersion": "2.1",
  "conformanceLevel": "AA",
  "version": "1.0.0",
  "items": [
    {
      "id": "nv-001",
      "criterion": "2.4.4",
      "description": "Link purpose is clear from link text or context",
      "procedure": "Review each link and verify the link text describes the destination or purpose",
      "expectedOutcome": "Link text is descriptive, not generic like 'click here' or 'read more'",
      "tools": ["WAVE", "Manual inspection"]
    },
    {
      "id": "nv-002",
      "criterion": "4.1.2",
      "description": "Links that open in new window indicate this behavior",
      "procedure": "Check links with target='_blank' have visual indicator and aria-label mentioning 'opens in new tab'",
      "expectedOutcome": "Users are informed before activating that link opens new window",
      "tools": ["Manual inspection"],
      "screenReaders": ["NVDA", "VoiceOver"]
    },
    {
      "id": "nv-003",
      "criterion": "4.1.2",
      "description": "Tab list has correct ARIA roles",
      "procedure": "Verify tablist has role='tablist', tabs have role='tab', and panels have role='tabpanel'",
      "expectedOutcome": "Screen reader announces tab structure correctly",
      "tools": ["Chrome Accessibility Inspector"],
      "screenReaders": ["NVDA", "VoiceOver"]
    },
    {
      "id": "nv-004",
      "criterion": "2.1.1",
      "description": "Tabs are navigable with arrow keys",
      "procedure": "Focus on tabs and use left/right arrows to navigate between tabs",
      "expectedOutcome": "Arrow keys move between tabs, Enter/Space activates the tab",
      "tools": ["Manual keyboard testing"]
    },
    {
      "id": "nv-005",
      "criterion": "4.1.2",
      "description": "Active tab has aria-selected='true'",
      "procedure": "Inspect active tab and verify aria-selected attribute",
      "expectedOutcome": "Only the active tab has aria-selected='true', others have 'false'",
      "tools": ["Chrome Accessibility Inspector"]
    },
    {
      "id": "nv-006",
      "criterion": "4.1.2",
      "description": "Tab panel is linked to tab via aria-controls and aria-labelledby",
      "procedure": "Verify tab has aria-controls pointing to panel ID, panel has aria-labelledby pointing to tab ID",
      "expectedOutcome": "Tab and panel are programmatically associated",
      "tools": ["Chrome Accessibility Inspector"]
    },
    {
      "id": "nv-007",
      "criterion": "2.4.8",
      "description": "Breadcrumb indicates current page",
      "procedure": "Verify last breadcrumb item has aria-current='page'",
      "expectedOutcome": "Screen reader announces current location in breadcrumb trail",
      "tools": ["Chrome Accessibility Inspector"],
      "screenReaders": ["NVDA", "VoiceOver"]
    },
    {
      "id": "nv-008",
      "criterion": "1.3.1",
      "description": "Breadcrumb uses nav landmark with aria-label",
      "procedure": "Verify breadcrumb is wrapped in <nav> with aria-label='Breadcrumb'",
      "expectedOutcome": "Screen reader identifies breadcrumb as navigation region",
      "tools": ["Chrome Accessibility Inspector"]
    },
    {
      "id": "nv-009",
      "criterion": "2.4.1",
      "description": "Skip link is provided for repeated content",
      "procedure": "Verify page has 'Skip to main content' link that is visible on focus",
      "expectedOutcome": "Keyboard users can bypass repeated navigation",
      "tools": ["Manual keyboard testing"]
    },
    {
      "id": "nv-010",
      "criterion": "4.1.2",
      "description": "Pagination current page is indicated",
      "procedure": "Verify current page in pagination has aria-current='page'",
      "expectedOutcome": "Screen reader announces which page is currently active",
      "tools": ["Chrome Accessibility Inspector"],
      "screenReaders": ["NVDA", "VoiceOver"]
    }
  ]
}
