{
  "id": "feedback",
  "name": "Feedback",
  "description": "Manual accessibility checklist for feedback components (alerts, toasts, progress indicators, spinners)",
  "wcagVersion": "2.1",
  "conformanceLevel": "AA",
  "version": "1.0.0",
  "items": [
    {
      "id": "fb-001",
      "criterion": "4.1.3",
      "description": "Status messages use appropriate ARIA live regions",
      "procedure": "Trigger status message and verify it uses role='status' or aria-live='polite'",
      "expectedOutcome": "Screen reader announces status message without moving focus",
      "tools": ["Chrome Accessibility Inspector"],
      "screenReaders": ["NVDA", "VoiceOver", "JAWS"]
    },
    {
      "id": "fb-002",
      "criterion": "4.1.3",
      "description": "Error alerts use appropriate role",
      "procedure": "Trigger error and verify it uses role='alert' or aria-live='assertive'",
      "expectedOutcome": "Screen reader immediately announces error, interrupting current task",
      "tools": ["Chrome Accessibility Inspector"],
      "screenReaders": ["NVDA", "VoiceOver"]
    },
    {
      "id": "fb-003",
      "criterion": "4.1.2",
      "description": "Alerts have accessible name",
      "procedure": "Verify alert has aria-labelledby or visible heading identifying the alert type",
      "expectedOutcome": "Screen reader announces alert type (error, warning, success, info)",
      "tools": ["Chrome Accessibility Inspector"]
    },
    {
      "id": "fb-004",
      "criterion": "2.1.1",
      "description": "Dismissable alerts can be closed with keyboard",
      "procedure": "Focus the dismiss button and press Enter or Space",
      "expectedOutcome": "Alert closes and focus moves appropriately",
      "tools": ["Manual keyboard testing"]
    },
    {
      "id": "fb-005",
      "criterion": "2.2.1",
      "description": "Toast auto-dismiss timing is adjustable or sufficient",
      "procedure": "Verify toast remains visible long enough to read (at least 5 seconds) or timing is adjustable",
      "expectedOutcome": "Users have sufficient time to read toast content",
      "tools": ["Manual testing"]
    },
    {
      "id": "fb-006",
      "criterion": "1.4.1",
      "description": "Alert type is not conveyed by color alone",
      "procedure": "Verify alerts use icons or text labels in addition to color to indicate type",
      "expectedOutcome": "Alert type is clear without relying on color perception",
      "tools": ["Grayscale mode"]
    },
    {
      "id": "fb-007",
      "criterion": "4.1.2",
      "description": "Progress indicator has accessible name",
      "procedure": "Verify progress bar/spinner has aria-label or aria-labelledby",
      "expectedOutcome": "Screen reader announces what is loading/processing",
      "tools": ["Chrome Accessibility Inspector"]
    },
    {
      "id": "fb-008",
      "criterion": "4.1.2",
      "description": "Determinate progress shows current value",
      "procedure": "Verify progress bar has aria-valuenow, aria-valuemin, and aria-valuemax",
      "expectedOutcome": "Screen reader can announce progress percentage",
      "tools": ["Chrome Accessibility Inspector"],
      "screenReaders": ["NVDA", "VoiceOver"]
    },
    {
      "id": "fb-009",
      "criterion": "4.1.3",
      "description": "Loading state changes are announced",
      "procedure": "Trigger loading state and verify completion is announced",
      "expectedOutcome": "Screen reader announces when loading completes or fails",
      "tools": ["Chrome Accessibility Inspector"],
      "screenReaders": ["NVDA", "VoiceOver"]
    },
    {
      "id": "fb-010",
      "criterion": "2.3.1",
      "description": "Loading animations do not flash rapidly",
      "procedure": "Verify spinner/progress animations do not flash more than 3 times per second",
      "expectedOutcome": "No risk of triggering seizures from rapid flashing",
      "tools": ["PEAT (Photosensitive Epilepsy Analysis Tool)"]
    }
  ]
}
